{"schema_version":"1.0.0-fixture","fixture":true,"operational":false,"phases":[{"name":"R1 reconstruction foundation","status":"complete","detail":"Archived and verified."},{"name":"R2A shared contracts","status":"in_progress","detail":"Task 2C failure registry is next."},{"name":"Events V2 E1 audit","status":"planned","detail":"Read-only current-system inventory."},{"name":"V2 implementation","status":"locked","detail":"Requires separate authorization and verified contracts."},{"name":"Shadow verification","status":"locked","detail":"Compare V2 outputs against V1 without production authority."},{"name":"Cutover","status":"locked","detail":"Requires explicit Howard approval and rollback readiness."}]}