{"schema_version":"1.0.0-fixture","fixture":true,"operational":false,"phases":[{"name":"Map V1 production","status":"complete","detail":"Current public discovery experience remains live."},{"name":"Feed and GPS stabilization","status":"in_progress","detail":"Continue reliability and review-tail work."},{"name":"V1 preservation package","status":"planned","detail":"Freeze compatibility and rollback evidence before cutover."}]}